{
  "schemaVersion": 1,
  "id": "ITEM_LOG_SPLIT_HALF_600",
  "displayNameKey": "item.log.split_half_600",
  "inventoryCategory": "Resource",
  "family": "Wood",
  "representation": "PhysicalActor",
  "unitMassKg": 6,
  "unitVolumeLiters": 25,
  "maxStack": 1,
  "requiresUniqueInstance": true,
  "durability": {
    "model": "None"
  },
  "stateModel": "WoodProcessing",
  "baseDefinitionId": "ITEM_LOG_WHOLE_600",
  "meshVariantSetId": "MSH_LOG_600_SPLIT_HALF",
  "allowedActions": [
    "Pickup",
    "Drop",
    "Process",
    "Place"
  ],
  "feedbackEventIds": [
    "SFX_WOOD_SPLIT"
  ],
  "tags": [
    "WOOD",
    "LOG",
    "SPLIT_HALF_ROUND"
  ],
  "persistencePolicy": "SaveWhenInWorld",
  "notes": "Example definition: a longitudinal split half-round; it is not a half-length log.",
  "acquisitionSourceIds": [
    "SRC_TREE_FALLEN"
  ]
}
